TranslatedRecipeName,TranslatedIngredients,TotalTimeInMins,Cuisine,TranslatedInstructions,URL,Cleaned-Ingredients,image-url,Ingredient-count
Thengai Sadam Recipe (A Quick and Healthy Coconut Rice),"1 cup Fresh coconut - grated,Salt - to taste,1 teaspoon Mustard seeds,1 Raw Peanuts (Moongphali) - fistful,1 + 1 tablespoon Coconut Oil,2-1/2 cups Cooked rice,2 teaspoons Chana dal (Bengal Gram Dal),3 or 4 Green Chillies - finely chopped,1 teaspoon Ginger - grated,2 teaspoons White Urad Dal (Split),1 sprig Curry leaves",60,South Indian Recipes,"To begin cooking the Thengai Sadam (Coconut Rice Recipe), heat a tablespoon of coconut oil in a heavy bottomed pan or wok.
Add the mustard seeds to the oil, and once it begins to crackle, add in the urad dal, channa dal and the peanuts.Once the dals begins to brown, add the green chillies, curry leaves and ginger and stir them together for a few minutes.Next, add in the coconut to the kadai and mix them all together.
Care should be taken to avoid any moisture remaining in the mixture, therefore keep stirring it properly until all the moisture in the coconut evaporates.
At this stage, stir in the cooked rice and salt and combine all the ingredients well.
Add a tablespoon of coconut oil to it to separate the grains of the rice.
Finally, add a tablespoon of coconut oil to the Thengai Sadam, to separate the grains of the rice.
Stir fry gently to combine all the ingredient taking care and ensuring that the rice does not get mashed, in the process.
Once combined, turn the heat to low and simmer for a couple of minutes.
Turn off the heat and serve the Thengai Sadam (Coconut Rice) hot with a potato roast and papad.",https://www.archanaskitchen.com/south-indian-thengai-sadam-recipe-a-quick-and-healthy-coconut-rice,"green chillies,salt,ginger,rice,mustard seeds,coconut,curry leaves,white urad dal (split),coconut oil,chana dal (bengal gram dal),peanuts (moongphali) fistful",https://www.archanaskitchen.com/images/archanaskitchen/Indian_Rice/Thengai_Sadam_Recipe_A_Quick_and_Healthy_Coconut_Rice-1_1600.jpg,11
Karwar Style Ambade Udid Methi Recipe - Hog Plum Curry,"1 tablespoon Coriander (Dhania) Seeds,6 Whole Black Peppercorns,4 Dry Red Chilli,2 teaspoons Sunflower Oil,Salt - to taste,1/2 teaspoon Mustard seeds,3/4 cup Fresh coconut - grated,1 teaspoon Black Urad Dal (Split),5 Hog Plum (Amtekai) - (Ambade),2 tablespoons Jaggery,1 Karela (Bitter Gourd/ Pavakkai) - (Small),1 teaspoon Rice - (raw rice),1/4 teaspoon Methi Seeds (Fenugreek Seeds),1/4 teaspoon Turmeric powder (Haldi),1 pinch Asafoetida (hing)",50,Coastal Karnataka,"To begin making the Karwar Style Ambade Udid Methi Recipe (Hog Plum Curry), firstly, scrape away the outer layer of the bitter gourd, clean it from inside and cut it into thin rings.
Apply a bit of salt to it (I used 1/4 teaspoon), toss well to coat and keep aside for about an hour to do away with the bitterness of bitter gourd.
After an hour, wash the chopped bitter gourd thoroughly and keep aside to drain.
Use a little oil and roast the bitter gourd rings on low heat in a kadai till crisp.
Peel and clean the Ambade meanwhile when the bitter gourd is roasting on low heat.
Heat a little oil in a kadai (a few drops each time) and lightly roast the coriander seeds, urad dal, methi seeds, rice grains, peppercorns, asafoetida piece and dry red chillies separately on low heat.As soon as each ingredient changes its colour, remove from flame and keep aside to cool.Once cooled, grind all these ingredients in a mixer grinder along with the grated coconut, using required water to form a smooth paste.
Add to this paste to a cup of water and mix well to form a semi-thick gravy and pour in the kadai.Now, add turmeric powder, ambade/hog plum/amtekai, jaggery, roasted bitter gourd rings, salt to taste and keep on a high heat stirring occasionally till it reaches boiling point.
Once it starts boiling, lower the heat and simmer for about 8-10 minutes or till the ambade are cooked and soft.
If you feel that the gravy has thickened too much by now, just add some water to bring back a medium consistency which is desirable.Check for seasoning and adjust salt and jaggery if required.
In a tadka pan, heat a bit of oil for tempering and when the oil is hot, add mustard seeds and asafoetida.
Pour this over the prepared udid methi.Serve Karwar Style Ambade Udid Methi Recipe (Hog Plum Curry) along with Steamed Rice and Sol Kadhi for a South Indian meal.",https://www.archanaskitchen.com/ambade-udid-methi-recipe-karwar-style-hog-plum-curry,"salt,coconut,asafoetida (hing),karela (bitter gourd pavakkai),hog plum (amtekai) (ambade),rice (raw rice),jaggery,black peppercorns,black urad dal (split),dry red chilli,mustard seeds,coriander (dhania) seeds,methi seeds (fenugreek seeds),turmeric powder,sunflower oil",https://www.archanaskitchen.com/images/archanaskitchen/1-Author/panditp253-gmail.com/AMBADE_UDID_METHI_Recipe_edited.jpg,15
Roasted Cauliflower Recipe,"3 tablespoon Extra Virgin Olive Oil,1/4 cup Anardana Powder (Pomegranate Seed Powder),Salt - to taste,1 teaspoon Coriander Powder (Dhania),2 teaspoon Cumin seeds (Jeera) - roasted and crushed,2 cups Cauliflower (gobi),4 Garlic - sliced,2 teaspoon Black pepper powder - or red chilli powder,2 tablespoons Pomegranate molasses - orhoney (optional but recommended),Fresh Herbs - Handful of herbs of choice like basil",40,South Indian Recipes,"To begin making the roasted cauliflower, first pre-heat the oven to 200 degree celsius.In a mixing bowl, toss together the olive oil, garlic and cauliflower florets.
Sprinkle salt as required.Place these florets on a baking tray and roast till they just soften (about 10-12 minutes).
Take the tray out of the oven.Add the coriander powder, cumin and black pepper powder.Mix and place it back in the oven to roast for another 10 to 12 minutes or till the cauliflower is cooked and caramelizes or slightly turns brown.
Take it out onto a serving dish.Garnish with pomegranate seeds, herbs and drizzle some molasses or honey over it.
Serve immediately.Serve Roasted Cauliflower as a starter or as a side dish along with Panchmel Dal and Phulkas for a weekday lunch or dinner",https://www.archanaskitchen.com/roasted-cauliflower-recipe,"herbs herbs choice like basil,salt,black pepper powder red chilli powder,anardana powder (pomegranate seed powder),cauliflower (gobi),virgin olive oil,garlic,cumin seeds (jeera),pomegranate molasses or,coriander powder",https://www.archanaskitchen.com/images/archanaskitchen/1-Author/Madhuli_Ajay/Roasted_cauliflower.jpg,10
Pain Viennois | Vienna Bread Recipe,"325 ml Lukewarm Water,500 grams Vivatta Maida - or half of bread flour,1 tablespoon Salt - or to taste,Egg white - for brushing (or milk),30 grams Milk Powder,14 grams Active dry yeast,2 tablespoons Sugar,3 tablespoons Butter (unsalted)",135,European,"To begin making Pain Viennois | Vienna Bread Recipe, in a bowl, combine water, sugar, yeast and milk powder in a big mixing bowl.
Allow it to stand for 10 minutes until bubbly and frothy.Add the flours, salt and butter to the yeast mixture and knead them to a dough.Later transfer it over a work surface and continue kneading until smooth and pliable for about 10 minutes.
Do not use any extra flour while kneading or shaping.Place the dough in a greased bowl and cover the container with a plastic wrap.
Set aside in a warm place until almost tripled in volume.Transfer the proofed dough on to a flat working surface and knead the dough for a minute or two to release the trapped air.
Divide the dough into 9 equal pieces and shape them into tight round balls.
Place them on a baking sheet and rest them for about 15 minutes.Flatten each dough ball to remove the air bubbles and shape them into tight 8 inch logs.
Place 4 to 5 logs over each baking tray lined with parchment paper.Brush their tops with milk or beaten egg.
Carefully score each log horizontally 12 to 15 times with a sharp blade or razor.
Allow them proof for about an hour until doubled.Bake them in a preheated oven at 450 degree fahrenheit for about 15 minutes rotating the trays half way through to ensure equal baking.Remove the baked buns and cool them on a wire rack to room temperature.
Vienna bread stays good for upto 2 days at room temperature and can be freezed for upto 3 weeks.Serve Pain Viennois | Vienna Bread Recipe after grilling it with Braised Pork Belly Recipe or along with Beetroot Gazpacho Soup Recipe for a light dinner.",https://www.archanaskitchen.com/pain-viennois-vienna-bread-recipe,"salt,water,dry yeast,sugar,vivatta maida bread flour,eggs brushing (or milk,milk powder,butter",https://www.archanaskitchen.com/images/archanaskitchen/1-Author/swapna_sunil/Pain_Vennois_Recipe.jpg,8
Crunchy Ginger Capsicum Rice Recipe,"Salt - to taste,2 teaspoon Butter,1 Red Bell pepper (Capsicum),2 cups Basmati rice - cooked,2 Green Chillies - finely chopped,1 Green Bell Pepper (Capsicum),2 inch Ginger - grated,2 teaspoon Sesame seeds (Til seeds) - mixed black and white,1 Yellow Bell Pepper (Capsicum)",40,Indian,"To begin making Crunchy Ginger Capsicum Rice Recipe, let's get the basmati rice ready.
Wash the basmati rice in running tap water until clear and soak for 30 minutes.Now, take a big pan, fill it with 3.5 cups of water and bring it to a rolling boil.
Add the soaked and drained rice, salt to taste, close it with a lid and cook for 20 minutes on a low flame.
The rice should be cooked to al dente (firm to bite).
Switch off the flame, let it rest for 10 minutes.Fluff up the rice with a fork such it does not become lumpy after cooling and keep aside.Now heat a kadai with some butter and a teaspoon of oil.
Oil will avoid the butter getting burnt or turning brown.Add the finely chopped bell peppers and green chillies.
Sauté for 2 minutes.Add the grated ginger and give it a good stir.Now add 2 cups of cooked basmati rice, season with salt and gently toss it to bring everything together.Garnish with toasted black and white sesame seeds and switch off the flame.Serve the Crunchy Ginger Capsicum Rice for kids lunch box or with chicken/vegetable Manchurian to make an interesting weeknight dinner.",https://www.archanaskitchen.com/crunchy-ginger-capsicum-rice-recipe,"yellow bell pepper (capsicum),basmati rice,red bell pepper (capsicum),ginger,salt,sesame seeds (til seeds) mixed black white,green bell pepper (capsicum),green chillies,butter",https://www.archanaskitchen.com/images/archanaskitchen/1-Author/Nithya_Anantham/Ginger_Capsicum_Rice_Recipe.jpg,9
Bengali Chirer Payesh / Poha Pudding Recipe With Nolen Gur,"2 Cardamom (Elaichi) Pods/Seeds,2 1/2 liter Milk,2 tablespoons Rice flour,1 tablespoon Raisins,pinch Salt,1/2 cup Poha (Flattened rice),8-10 Mixed nuts - almonds/cashews,1 cup Nolen Gur - or brown sugar,1 pinch Saffron strands - and a little more for garnish",45,Bengali Recipes,"To cook Bengali Chirer Payesh/Poha Pudding Recipe With Nolen Gur, wash poha/chirer with water and strain the poha.Soak the washed and drained poha/chirer in a cup of milk.Also mix 1/2 cup of milk with rice flour and keep aside.Soak saffron in a little milk.
Keep aside.Boil the rest of milk and cardamom pods together in a Saucepan and bring to boil.
Stir occasionally.Add rice flour mix in boiling milk and stir constantly.Boil about 12-15 minutes till the rice flour is cooked and milk is condensed.Now add milk soaked flattened rice/chirer then add the milk soaked saffron.Cook chirer payesh for 15 minutes more or when flattened rice/chirer is cooked well and milk thickens considerably, add nolen gur or brown sugar.Stir it and cook it till the date jaggery/brown sugar dissolves.
Then add chopped almonds/cashews and a pinch of salt, cook for a minute and remove from heat.Pour the Bengali Chirer Payesh/Poha Pudding Recipe With Nolen Gur in a serving bowl, garnish with saffron strands/almonds/cashews and raisins and serve hot or chilled with sumptuous meal of Cholar Dal Recipe/ Aar Macher Jhol Recipe and jeera rice for dinner.",https://www.archanaskitchen.com/bengali-chirer-payesh-poha-pudding-recipe-with-nolen-gur,"salt,nolen gur brown sugar,cardamom (elaichi) podsseeds,poha (flattened rice),milk,saffron strands,raisins,mixed nuts almondscashews,rice flour",https://www.archanaskitchen.com/images/archanaskitchen/Indian_Sweets_Mithai/chirer-payesh-poha-pudding-recipe-with-nolen-gur.jpg,9
Shanghai Style Chap Nian Gao Recipes (Stir Fried Rice Cakes Recipes),"1 teaspoon Sugar,1 Carrot (Gajjar) - thinly sliced,1/2 cup Button mushrooms - quartered,1 tablespoon Dark soy sauce,Sunflower Oil - for cooking,Salt - to taste,1 cup Rice flour,1/2 cup Cabbage (Patta Gobi/ Muttaikose),2 tablespoons Corn flour,1 Bok Choy - sliced,1 teaspoon Red Chilli sauce,1 tablespoon Bean Paste",100,Chinese,"We begin making the Shanghai Style Chap Nian Gao Recipes (Stir Fried Rice Cakes Recipes) by preparing the rice cakes, so mix all the ingredients in a microwave bowl and add 1/2 cup water.
Mix thoroughly and make it into a sticky paste.Cover the bowl with cling film, leaving an inch open.
Place it in the microwave oven for 2 minutes on high.
Remove and add 1/4 water and mix it again and repeat the process.Once done remove dough and it and place it on the board and using a muddler, pound the dough in order to combine and get a smooth consistency.
You can apply some oil on the board before doing this process to prevent sticking.
Pound the dough for 5 minutes.After it is done, use your hand to bind it together and knead it for 2 minutes.
Divide the dough into two and roll it into the cylindrical shape by applying some more oil on your hand as well as on the board.
Wrap it using a cling film and store it in the fridge for 1 hour.Remove from the fridge and cut them lengthwise and keep it aside.
Heat a wok with oil, add ginger and garlic, saute for few seconds.Add all the vegetables and saute them till it is cooked, you can add some water and cover it and let it cook.Meanwhile,mix all the sauce ingredients in a small bowl with 1/4 water and keep it aside.
Once the vegetables are done , pour in the sauce mixture and keep stirring till it thickens.At this point, you can add in the rice cakes and give it a stir.
Serve the Shanghai Style Chap Nian Gao Recipes (Stir Fried Rice Cakes Recipes) along with General Tso cauliflower for a satisfying lunch.",https://www.archanaskitchen.com/shanghai-style-chap-nian-gao-recipes-stir-fried-rice-cakes-recipes,"salt,corn flour,bok choy,carrot,dark soy sauce,sugar,bean paste,button mushrooms,rice flour,red chilli sauce,cabbage (patta gobi muttaikose),sunflower oil",https://www.archanaskitchen.com/images/archanaskitchen/1-Author/sibyl_sunitha/Shanghai_Style_Chap_Nian_Gao_Recipes_Stir_Fried_Rice_Cakes_Recipes.jpg,12
White Pumpkin Mor Kuzhambu Recipe - Kerala Style White Pumpkin Curry,"1 cup Vellai Poosanikai (Ash gourd/White Pumpkin) - cubed,1/3 cup Water,1 Dry Red Chilli,1/4 teaspoon Black pepper powder,Salt - as per your taste,4 Green Chillies,1/4 teaspoon Mustard seeds,1/2 cup Fresh coconut,1/4 teaspoon Methi Seeds (Fenugreek Seeds),1 teaspoon Coconut Oil,1/4 teaspoon Turmeric powder (Haldi),1-1/2 cups Curd (Dahi / Yogurt) - thick,1 sprig Curry leaves",35,Kerala Recipes,"To begin making White Pumpkin Mor Kuzhambu, we need to first cook the pumpkin.
Pressure cook the white pumpkin with little water in a pressure cooker for 2 whistles and release the pressure immediately by running the cooker under cold water.
 Keep aside.Meanwhile, whisk curd with water in a bowl until the its smooth.
Make sure that there are no lumps in the curd.Next, add grated coconut, green chilli, black pepper powder in a mixer grinder and grind it to a smooth paste with a little water.
Your Kuzhambu paste is ready.Transfer this kuzhambu paste to the curd and mix well.
Once it is mixed properly, add in turmeric powder, cooked white pumpkin, salt and mix everything well.
Place this mixture on low heat in a saucepan and allow the mixture to become warm.
You will notice a light froth around the edges of the vessel.
Do not let the mixture boil, the curd will split on high heat.
Turn off the flame the moment you see froth.
The next step is to temper the kuzhambu.In a tempering pan/tadka pan, add one teaspoon of coconut oil.
Once the oil is hot, add mustard seeds and fenugreek seeds, Once the mustard seeds starts to crackle, add the curry leaves, dry red chilli and give it a mix.
Turn off the flame and add this tempering to the Mor Kuzhambu.
Your Mor Kuzhambu is ready to be served.
Serve Mor Kuzhambu with Steamed Rice and Menthia Keerai Paruppu Usili for a simple weekday lunch.",https://www.archanaskitchen.com/white-pumpkin-mor-kuzhambu-recipe-kerala-style-white-pumpkin-gravy,"salt,coconut,mustard seeds,vellai poosanikai (ash gourdwhite pumpkin),water,dry red chilli,curd,curry leaves,coconut oil,methi seeds (fenugreek seeds),black pepper powder,turmeric powder,green chillies",https://www.archanaskitchen.com/images/archanaskitchen/1-Author/vinithavijayam1990-gmail.com/Kerala_Style_Mor_Kuzhambhu___White_Pumkin_Mor_Kuzhambhu.jpg,13
Paneer and Green Peas Paratha Recipe - Paneer and Green Peas Paratha Recipe," 1 tsp coriander powder, 1 cup wheat flour, 1 tsp turmeric powder, 1 tsp mango powder Powder,1/2 cup green peas - make paste, water - lukewarm, cut 1 inch ginger - 1 green chili - chopped, 2 tsp red chili powder, oil - according to use, salt - according to taste, 1 cup cheese - crumble",65,North Indian Recipes,"To make paneer and green pea paratha recipe, prepare all the ingredients first.
To make paratha flour: Now add wheat flour, salt, oil and mix in a bowl.
Add a little water and knead the dough.
Cover and keep aside.
To make the masala: Heat the oil in a pan.
Add cumin seeds and cook for a few seconds.
Now add ginger, green peas and cook half.
Now add cottage cheese, red chilli powder, coriander powder, mango powder, salt.
Mix well and keep aside.
Let it cool down.
Now take a little piece of flour and roll it out.
Place the mixture of paneer peas in the middle and close it from all sides.
Now coat it with dry flour.
Take the vine again.
Only fat, or else spices can come out.
Make all such parathas.
Heat a griddle.
Put paratha on it and apply ghee on top.
Cook till it turns golden brown from both sides and turn off the gas.
Serve Paneer and Hare Matar Paratha Recipe with Coriander Mint Chutney and Tadka Raita for an evening snack.",https://www.archanaskitchen.com/paneer-and-green-peas-paratha-recipe-in-hindi,"turmeric powder,salt,wheat flour,mango powder powder,ginger green chilli,red chilli powder,water,oil,coriander powder,cheese crumble,green peas",https://www.archanaskitchen.com/images/archanaskitchen/1-Author/sibyl_sunitha/Paneer_and_Green_Peas_Paratha_Recipe_.jpg,11
Elephant Yam Raita (Recipe In Hindi)," 1/2 green chilli, 1-1 / 2 teaspoon Rye, asafetida - a pinch,250 grams Elephant yam, salt - as per taste, 3 tablespoons coriander - chopped, 1 inch ginger, 1 cup curd, 1 teaspoon oil, 1-1 / 2 teaspoon Kali Urad Dal (Split)",40,Indian,"To make Senai Pachadi, first peel and cut the yam into small pieces.
Now in a pressure cooker add water, yam as per use and cook till 3 cities come.
With the pressure coming out automatically, take out the yam separately.
Also keep the remaining water separately.
Now add green coriander, green chillies, ginger and yam in a mixer grinder.
Grind.
Now heat oil in a tempering pan.
Add the ingredients given for tempering and cook it for 30 seconds.
In a bowl, add yam mixture, curd and remaining water and mix.
Add tempering to it and mix once more.
Serve.
Serve senai pachdi with mixed vegetable sambar, beetroot thoran and rice for dinner.",https://www.archanaskitchen.com/senai-pachadi-recipe-elephant-yam-raita-in-hindi,"salt,rye,ginger,green chilli,kali urad dal (split),coriander,elephant yam,curd,oil,asafetida",https://www.archanaskitchen.com/images/archanaskitchen/1-Author/Neeru_Srikanth/Senai_Pachadi.jpg,10
Drunken Noodles Recipe - Drunken Noodles Recipe," 1 tbsp fish sauce, 1/4 cup capsicum (red) - cut, 1/2 cup baby corn - cut, 6 cloves garlic - finely chopped, 1/2 tbsp brown sugar, 1/2 Tbsp honey, 1/4 cup capsicum (green) - cut, 1/3 cup green onions, 1/4 cup Thai Basil leaves - cut, 1 inch ginger - finely chopped, 1 tbsp soy sauce,200 grams rice noodles, 1 tbsp Sriracha sauce, 1/4 cup capsicum (yellow) - cut",35,Thai,"To make the drunken noodles recipe, firstly boil the flat noodles.
Boil 2 cups of water in a saucepan.
Add a pinch of salt and some oil to it and let it boil on high heat.
When the water boils, add the noodles and cook till it becomes soft.
Take care not to boil too much.
Turn off the gas and drain the water.
Keep the noodles under cold water, so that the noodles stop cooking.
Transfer the noodles to a bowl.
Add some oil and mix it with your hands.
Keep it aside.
To make the drunken noodle sauce, add brown sugar, honey, soy sauce, fish sauce and Sriracha sauce in a mixing bowl.
Add 1 tablespoon of hot water to it, mix and keep it aside.
Heat oil in a pan.
Add ginger garlic to it and cook for 30 seconds.
Now add onions and cook for 1 minute.
After 1 minute add all three capsicum, baby corn and cook till the vegetables become soft.
Now add salt, rice noodles and mix it.
Now add the drunken noodle sauce and cook for 3 to 4 minutes.
Turn off the gas and serve.
Serve the Drunken Noodles recipe with Basil Chicken and Thai Style Cheese for a weekend dinner.
You can also serve tender coconut ice cream with it.",https://www.archanaskitchen.com/drunken-noodles-recipe-pad-kee-mao-in-hindi,"fish sauce,ginger,capsicum (green),capsicum (yellow),capsicum (red),thai basil leaves,cloves garlic,baby corn,soy sauce,sriracha sauce,green onion,rice noodles,brown sugar",https://www.archanaskitchen.com/images/archanaskitchen/1-Author/Donna_George/Drunken_Noodles_Recipe_With_Vegetables_-2_1600.jpg,13
Chettinad Style Prawn Biryani Recipe,"3 tablespoons Fresh coconut - grated,1 teaspoon Coriander Powder (Dhania),1 teaspoon Red Chilli powder,2 Black cardamom (Badi Elaichi),1 teaspoon Garam masala powder,200 grams Shrimps - or prawns,1/2 cup Hung Curd (Greek Yogurt),2 Bay leaves (tej patta),1 teaspoon Green Chilli - paste,1/2 teaspoon Cumin seeds (Jeera),2-3 Dry Red Chilli,5-6 Whole Black Peppercorns,1 cup Sunflower Oil,1-1/2 cups Basmati rice,4 Cardamom (Elaichi) Pods/Seeds,1/2 teaspoon Turmeric powder (Haldi),4-5 Shallots,2 sprig Curry leaves,1 inch Cinnamon Stick (Dalchini),1 tablespoon Ginger - paste,2 tablespoons Ghee,1 tablespoon Garlic - paste",55,Chettinad,"To prepare Chettinad Style Prawn Biryani Recipe, wash and clean prawns well, collect in a bowl and add ginger garlic paste, red chili powder, turmeric, few drops of lemon juice and 2-3 pinch salt.
Mix well and marinate for 15-20 minutes.Wash and soak rice in water for a minimum 30 minutes before cooking.Heat oil in a large and thick bottomed handi and add the whole spices and wait till they splutter.Now add shallots and saute them till they are pale in color.Add green chili paste, grated coconut and marinated prawns and mix well.Fry for 4-5 minutes and then slowly add curd and carefully mix everything to avoid breaking the prawns.Keep the flames high and let the water from curd dry up completely.Season with coriander powder, garam masala powder and salt.
Fry till it is cooked and deeper in color.Now add the soaked rice and again stir well such that everything incorporates well with each other.Add warm water (double the quantity of rice), check salt and add a dollop of ghee and mix well.Allow the rice to come to a boil, close the lid and let the rice cook at low heat.Keep the lid covered till the rice is done.
Gently mix the rice and collect in a serving bowl.Garnish with chopped coriander and chopped curry leaves.Serve the Chettinad Style Prawn Biryani hot with raita for a wholesome meal.",https://www.archanaskitchen.com/chettinad-style-prawn-biryani-recipe,"basmati rice,black peppercorns,curry leaves,cumin seeds (jeera),turmeric powder,green chilli paste,sunflower oil,black cardamom (badi elaichi),ginger paste,cardamom (elaichi) podsseeds,garam masala powder,coconut,red chilli powder,dry red chilli,garlic paste,hung curd (greek yogurt),bay leaves (tej patta),ghee,shrimps prawns,cinnamon stick (dalchini),coriander powder",https://www.archanaskitchen.com/images/archanaskitchen/1-Author/Shaheen_Ali/CHETTINAD_STYLE_PRAWN_BIRYANI.jpg,21
Walnut and Flax Seed Trail Mix Recipe With Figs and Honey,"1/3 cup Flax seeds,1 cup Dried Figs,1 cup Walnuts,1 teaspoon Cinnamon Powder (Dalchini),1/3 cup Honey,1/2 cup Roasted Peanuts (Moongphali)",25,Continental,"To begin making the Walnut and Flax Seed Trail Mix Recipe With Figs & Honey, in a mixing bowl, combine the walnuts, figs, flax seeds, honey, roasted peanuts and the cinnamon powder.
Preheat an oven to 190 degree celsius.
Transfer the Walnut and Flax Seed Trail Mix onto a baking tray and bake for 12 to 15 minutes until they are crisp.Remove the tray from the oven.
Allow the Walnut and Flax Seed Trail Mix to cool and transfer to an airtight jar and store.Serve Walnut and Flax Seed Trail Mix Recipe With Figs & Honey along with  Watermelon Smoothie Recipe as an after school snack for your kids.",https://www.archanaskitchen.com/walnut-and-flax-seed-trail-mix-recipe-with-figs-and-honey,"dried figs,flax seeds,peanuts (moongphali),walnuts,cinnamon powder (dalchini)",https://www.archanaskitchen.com/images/archanaskitchen/1-Author/Shyma_Menon/Walnut_and_Flax_Seeds_Trail_Mix_Recipe_With_Figs_and_Honey-3_1600.jpg,5
