TranslatedRecipeName,TranslatedIngredients,TotalTimeInMins,Cuisine,TranslatedInstructions,URL,Cleaned-Ingredients,image-url,Ingredient-count
Lentils and Mixed Grains Khichda Recipe,"2-3 Green Chilli,1/4 cup Coriander (Dhania) Leaves,1 teaspoon Turmeric powder (Haldi),1/4 cup Chana dal (Bengal Gram Dal),4 cloves Garlic - crushed,1 teaspoon Cumin powder (Jeera),Sunflower Oil - for cooking,1/4 cup Masoor Dal (Whole),3 Onions - finely chopped,1 tablespoon Lemon juice,Salt - to taste,2 inch Ginger - crushed,1/4 cup Jowar Seeds - soaked for 3 hours,1/2 cup Rice,1/4 cups Broken Wheat (Dalia/ Godumai Rava) - soaked for 3 hours,2 sprigs Curry leaves,1/2 teaspoon Asafoetida (hing),1/4 cup Bajra (seeds) - soaked for 3 hours,2 teaspoons Red Chilli powder,3 teaspoons Garam masala powder",60,Rajasthani,"To prepare the Lentils and Mixed Grains Kichada Recipe, first get all the ingredients handy.Drain water from the soaked wheat and bajra and grind them in a mixer grinder to make a coarse paste.Pour water (5 cups) in a deep kadai just enough to cook the coarse grain mixture.Add 1 cup of rice and chana dal to the boiling mixture.After 10 minutes when the rice is half done, add in masur dal, turmeric powder, salt and mix well.
Allow it to cook further for about 10 minutes on a medium flame.Take another deep frying pan to heat oil.
Once the oil is hot, fry in onions till golden brown.Add in green chillies, ginger garlic paste and jeera powder and mix it well.Simmer the flame to toss in red chilli powder, garam masala powder, curry leaves and hing powder.
Saute for half a minute.Slowly add cooked cereals to it and mix until the masala blends in it evenly.Garnish the Lentils and Mixed Grains Kichada Recipe with a generous pinch of finely chopped coriander, a few rings of onion and lemon for the dish to look as yummy as it tastes.",https://www.archanaskitchen.com/lentils-and-mixed-grains-kichada-recipe,"salt,wheat (dalia godumai rava),ginger,cumin powder (jeera),chana dal (bengal gram dal),rice,green chilli,coriander (dhania) leaves,asafoetida (hing),jowar seeds,red chilli powder,cloves garlic,onion,lemon,curry leaves,bajra (seeds),turmeric powder,masoor dal,garam masala powder,sunflower oil",https://www.archanaskitchen.com/images/archanaskitchen/1-Author/Rameshwari_Bansod/Mix_Khichada1.jpg,20
Chettinad Pakora Curry Recipe,"1 Tomato - finely chopped,1 teaspoon Red Chilli powder,1 Onion - finely chopped,1/2 cup Chana dal (Bengal Gram Dal) - soaked for 20 minutes,Salt - to taste,2 Cardamom (Elaichi) Pods/Seeds,2 teaspoons Coriander (Dhania) Leaves - finely chopped for garnish,5 Cashew nuts,2 tablespoons Roasted Gram Dal (Pottukadalai),1 teaspoon Poppy seeds,1 tablespoon Sunflower Oil,2 teaspoons Coriander Powder (Dhania),7 cloves Garlic - finely chopped,Sunflower Oil - for frying the pakodas,1 Cinnamon Stick (Dalchini),1 teaspoon Fennel seeds (Saunf),2 Dry Red Chillies,1 Green Chillies - finely chopped,1 Bay leaf (tej patta),1 sprig Curry leaves,2 tablespoons Fresh coconut",50,Chettinad,"To begin making Chettinad Pakoda Curry Recipe, we first prepare making the batter for the pakodas.Soak the channa dal along with red chillies for 20 minutes and then grind it with fennel seeds, salt using a mixer grinder to a coarse paste with very little water.Now, heat oil in a pan, and drop a spoon full of the pakoda mix into the oil and fry until golden brown in medium heat.Remove it on a kitchen towel and keep aside.Like wise, prepare the next batch of the pakodas with the remaining batter and keep aside.Now, grind the ingredients mentioned in the 'to grind' table to a smooth paste using a mixer grinder and keep aside.To prepare the gravy, heat oil in a pan, add the bay leaf, cinnamon stick, cardamom and let it release its aroma into the oil.Add the fennel seeds, curry leaves and let it splutter.Add the garlic and fry until golden brown.Add the finely chopped onions and saute until transparent.Add the tomatoes, green chillies, a pinch of saute and saute until the tomatoes are mushy.Add the coriander and red chilli powder and saute for a minute.Now, add the ground paste, 1.5 cups of water, salt and simmer until the masala paste is cooked well and the gravy comes together.Add in the prepared pakodas and simmer for another 5 minutes.The gravy will eventually be watery, but the pakodas will soak up the water and thicken the gravy.Switch off the flame and garnish with coriander leaves.Serve the Chettinad Pakoda Curry Recipe along with Tawa Parathas or Roti's, Steamed Rice, Poondu Rasam and Papad.",https://www.archanaskitchen.com/chettinad-pakoda-curry-recipe,"tomato,cloves garlic,curry leaves,onion,green chillies,chana dal (bengal gram dal),sunflower oil,salt,cardamom (elaichi) podsseeds,dry red chillies,coconut,coriander (dhania) leaves,red chilli powder,cashew nuts,sunflower oil the pakodas,bay leaf (tej patta),fennel seeds (saunf),gram dal (pottukadalai),cinnamon stick (dalchini),poppy seeds,coriander powder",https://www.archanaskitchen.com/images/archanaskitchen/1-Author/nithya.anantham/Chettinad_Pakoda_Curry_Recipe.jpg,21
Banana Pomegranate Raita Recipe - Kela Anar Raita,"1 cup yogurt, 1/2 teaspoon cumin powder - take it out, 1 teaspoon Dijon mustard, 1/4 teaspoon red chili powder, 1 cup banana - fried, 1 teaspoon sugar, 1/4 cup pomegranate, salt - According to taste",150,Indian,"To make Banana Pomegranate Raita, firstly add curd, salt, red chili powder, sugar, Dejon mustard and cumin powder in a bowl.
Mix well.
After mixing, add pomegranate and banana.
Put the bowl in the fridge for 2 hours and mix.
Serve.
Serve banana pomegranate raita with gourd elder greens and phulka for dinner.",https://www.archanaskitchen.com/kela-anar-raita-recipe-in-hindi,"salt,yogurt,red chilli powder,sugar,cumin powder take out,dijon mustard,pomegranate,banana",https://www.archanaskitchen.com/images/archanaskitchen/Indian_Raitas/Paka_Kela_Anar_Raita_Banana_Pomegranate_Yogurt_Dip_Flavoured_with_Mustard-1.jpg,8
Dhania Wale Aloo Recipe - Coriander Potato Dry,"1/2 teaspoon Cumin powder (Jeera),500 grams Baby Potatoes,2 teaspoons Sesame seeds (Til seeds) - dry roasted,1 Green Chilli,1 cup Coriander (Dhania) Leaves - roughly chopped,1/2 teaspoon Black pepper powder,1 inch Ginger,1/2 teaspoon Garam masala powder - optional,2 teaspoons Lemon juice,1 tablespoon Ghee - or clarified butter,Rock Salt - you can use the normal salt too",40,Indian,"To begin making the Dhania Wale Aloo Recipe, wash and boil the baby potatoes in a pressure cooker to two whistles (until they are cooked yet firm), peel and keep aside.Also, dry roast sesame seeds in a pan in low heat to golden brown colour and keep aside.Next, add all the ingredients mentioned in the 'Dhania Chutney' including coriander leaves, green chillies, ginger and grind it to a smooth paste with little water using a hand blender or mixer and keep aside.Heat ghee in a heavy bottomed pan on low flame, add the cumin seeds powder, pepper, garam masala and sendha namak or rock salt.Add the boiled baby potatoes and sauté until they are mildly roasted in low heat.
This will take around 10 minutes.Now, add the dhania chutney that we prepared earlier to the potatoes and give it a good toss.Let the potatoes simmer for 10 minutes, occasionally stir in-between, until the potatoes are well coated by the masala paste.Switch off the flame, add the lemon juice and give it a good toss.Garnish with toasted sesame seeds and serve hot.
Serve Dhania Wale Aloo along with Phulkas and Palak Raita for a weekday lunch or dinner.",https://www.archanaskitchen.com/dhania-wale-aloo-recipe-coriander-potato-dry,"cumin powder (jeera),sesame seeds (til seeds) dry,ginger,green chilli,ghee,coriander (dhania) leaves,lemon,baby potatoes,black pepper powder,salt you can the normal salt too,garam masala powder",https://www.archanaskitchen.com/images/archanaskitchen/1-Author/Nithya_Anantham/Dhania_Wale_Aloo_Recipe.jpg,11
Case Podimas Recipe (South Indian Style Blindine Mash),"1 Green Chilli - finely chopped,Salt - to taste,4 Raw Banana - par boiled and grated thick,1/2 teaspoon White Urad Dal (Split),1 teaspoon Mustard seeds,1/2 cup Fresh coconut - grated,1 Onion - finely chopped,1 teaspoon Ginger - grated,1 tablespoon Sunflower Oil,1 sprig Curry leaves",20,Tamil Nadu,"To begin making Vazhakkai Podimas Recipe, pressure cook the plantains along with the skin with 1/2 cup water using a pressure cooker for 2 whistles.Once the plantains are cooked, peel its skin, grate is and keep aside.Heat oil in a pan on medium flame, add the mustard seeds, urad dal and let it crackle.Add the curry leaves and let it splutter.Add the onions, green chillies and ginger and saute until the onions turns translucent.Add the grated plantains, season with salt and saute over medium heat for 5 minutes.Once its done, add the grated coconut, give it a good stir and switch off the flame.Serve the Vazhakkai Podimas Recipe along with Steamed Rice and Mixed Vegetable Sambar Recipe for the weeknight dinner.",https://www.archanaskitchen.com/vazhakkai-podimas-recipe-south-indian-style-plantain-mash,"salt,ginger,green chilli,mustard seeds,coconut,curry leaves,white urad dal (split),onion,banana,sunflower oil",https://www.archanaskitchen.com/images/archanaskitchen/1-Author/nithya.anantham/Vazhakkai_Podimas_Recipe_South_Indian_Style_Plantain_Mash.jpg,10
Baked Potato-Spaghetti Rolls Recipe,"2 inch Ginger,4 Green Chilli - (adjust),2 teaspoon Extra Virgin Olive Oil,3/4 cup Fried Bread Cubes (Croutons) - seasoned with chopped garlic & dried rosemary,10 sprigs Coriander (Dhania) Leaves,Salt and Pepper - to taste,1 Potato (Aloo),50 gram Spaghetti Pasta,Lemon juice - few drops",70,Fusion,"To prepare Baked Potato-Spaghetti Rolls Recipe, cook spaghetti in a pan of water as per the instructions mentioned on the spaghetti packet, drain and cool it when done.Peel and cut potato into small pieces and boil in a pressure cooker for about 3 whistles and mash it.Powder the croutons in a mixer.
and keep it aside.
Coarsely bend in coriander leaves, ginger, green chili in the mixer and keep it aside.Chop the cooled spaghetti into small pieces and keep it aside.
Add potato, spaghetti, croutons, coriander leaves mix, salt into a single pot.Add few drops of lemon.Mix and mash everything together.
Take a small portion and make them into oval shaped balls.Do the same for the rest of the mixture.
Place them on a tray, covered with a cling film.
Keep them in a refrigerator for a minimum of 20 minutes.Preheat Oven for 5 minutes at 180 degrees Celsius.Take an Oven tray and brush oil.
Covering with aluminum foil is optional.Take the potato-spaghetti rolls and place them in the tray.
Brush oil.
One side is enough.Place the tray inside the oven and bake for 30, and keep checking at every 15 minutes.Brush oil if necessary but this is optional.Flip the pieces once the bottom side is cooked.
Generally, the bottom side gets cooked faster and it again depends on your oven.Potato Spaghetti Rolls Recipe is ready to be served hot with Dhaniya Pudina chutney recipe or Roasted Tomato Sauce Recipe.",https://www.archanaskitchen.com/baked-potato-spaghetti-rolls-recipe,"gram spaghetti pasta,salt,ginger,green chilli,potato (aloo),virgin olive oil,bread cubes (croutons) seasd garlic dried rosemary,coriander (dhania) leaves,pepper,lemon drops",https://www.archanaskitchen.com/images/archanaskitchen/1-Author/Neeru_Srikanth/Baked_Potato_Spaghetti_Rolls_recipe.jpg,10
Rajasthani Ghasela recipe - Besan Ka Pitta (Recipe in Hindi)," green coriander - little, 1 teaspoon cumin seeds, 1 teaspoon red chilli powder, 1 onion - finely chopped, 1-1 / 2 cup gram flour, 2 green chillies - finely chopped, 1 teaspoon turmeric powder, green onions - little, 1/2 teaspoon asafoetida, salt - as per taste,Oil - As per use",30,Rajasthani,"To make Rajasthani ghasela, first heat oil in a pan.
Add cumin and asafoetida to it.
After 10 seconds, add green chilies and onions.
Let the onion cook till it becomes soft.
Meanwhile, add gram flour and water in a bowl.
Mix well and then add red chili powder, turmeric powder and salt.
Mix them all and add chopped green onions.
Put this mixture in the pan and keep stirring.
Stir it for 20 minutes until the gram flour is cooked well.
After cooking, garnish with green coriander and serve hot.
Serve Rajasthani Ghasela with Garlic Dal, Bundi Raita and Phulka for dinner.",https://www.archanaskitchen.com/besan-ka-pitta-recipe-in-hindi,"coriander (dhania) leaves,turmeric powder,salt,asafoetida,red chilli powder,green onion,onion,oil,green chillies,cumin seeds,gram flour",https://www.archanaskitchen.com/images/archanaskitchen/1-Author/Pooja_Thakur/Rajasthani_Ghasela_Recipe_Besan_Ka_Pitta.jpg,11
Andhra Style Bendakaya Charu Recipe - Ladies Finger Rasam,"1 teaspoon Sugar,1/2 teaspoon Turmeric powder (Haldi),1/2 teaspoon Mustard seeds,Salt - to taste,4 Garlic,1 teaspoon Ghee,6 Bhindi (Lady Finger/Okra),1 cup Tamarind Water,1 teaspoon Red Chilli powder,1 teaspoon Coriander Powder (Dhania),1 Dry Red Chilli - broken into half,6 Pearl onions (Sambar Onions) - quartered,1/4 teaspoon Methi Seeds (Fenugreek Seeds),1/4 teaspoon Asafoetida (hing),1/2 teaspoon Cumin seeds (Jeera),1 sprig Curry leaves,2 Tomato - roughly chopped",25,Andhra,"We begin making the Andhra Style Vendakaya Charu Recipe (Ladies Finger Rasam Recipe) by placing  a pressure cooker on medium flame with ghee and the mustard seeds and allow them to splutter, next add  cumin seeds, fenugreek seeds, dry red chillies, curry leaves and allow them to crackle.
Next add in the chopped onions, and garlic pods.
Saute till it is translucent.
Then add in the tamarind water,  sugar, salt, red chilli powder, turmeric powder, asafoetida, coriander powderand chopped tomatoes and okra.
Stir well.Pressure cook the rasam for about 3 whistles, turn off the flame and allow the pressure to release naturally.
Serve the Andhra Style Vendakaya Charu Recipe (Ladies Finger Rasam Recipe) with  Chettinad Beans & Cauliflower Poriyal Recipe, hot steamed rice with a teaspoon of ghee to enrich the taste.",https://www.archanaskitchen.com/andhra-style-vendakaya-charu-recipe-ladies-finger-rasam-recipe,"tomato,salt,tamarind water,asafoetida (hing),ghee,mustard seeds,red chilli powder,dry red chilli,pearl onion (sambar onion),sugar,curry leaves,garlic,cumin seeds (jeera),methi seeds (fenugreek seeds),bhindi (lady fingerokra),coriander powder,turmeric powder",https://www.archanaskitchen.com/images/archanaskitchen/1-Author/sibyl_sunitha/Andhra_Style_Vendakaya_Charu_Recipe_Ladies_Finger_Rasam_Recipe.jpg,17
Mexican Vegetarian Burrito Bowl Recipe,"1/2 teaspoon Red Chilli flakes,Guacamole - 1 recipes,1 Onion - chopped,1/2 cup Lettuce leaves - shredded (optional),3 teaspoon Extra Virgin Olive Oil,1 Green Bell Pepper (Capsicum) - sliced,1 Tomato - chopped,1 Yellow Bell Pepper (Capsicum) - sliced,Salt - =to taste,2 cups Del Monte Whole Corn Kernels - fire roasted,Salt - to taste,3/4 cup Cheddar cheese - or Mexican cheese,1 Chipotle Chillies / Peppers - chopped (or 1 flat teaspoon red chilli flakes),2 cloves Garlic - crushed,1 Onion - sliced,2 cups Rajma (Large Kidney Beans) - cooked but not drained,1 Red Bell pepper (Capsicum) - sliced (or use any other vegetables that can be stir fried),1 cup Homemade tomato puree,2 teaspoon Cumin seeds (Jeera) - roasted,Coriander (Dhania) Leaves - small bunch,1/4 cup Black olives - sliced,1 Coriander (Dhania) Leaves - finely chopped,3 teaspoon Sunflower Oil,3 cloves Garlic - crushed,2 teaspoons Whole Black Peppercorns - crushed,1/2 teaspoon Red Chilli flakes - (optional),2 tablespoons Lemon juice,2 cups Cooked rice - fluffy,1 teaspoon Dried oregano",75,Mexican,"To begin making the Mexican Vegetarian Burrito Bowl, you need to prepare the various components first.For the coriander-lime rice, to the cooked rice, add the chopped coriander, lime juice, black pepper and salt.
Toss the mix together till all the flavors are well combined.For the spicy beans, place a pan on heat, add some oil to it and allow it to get warm.Add the onion, garlic and sauté it for 1-2 minutes until the onions are softened.
Then add tomato puree and cook for 5-10 minutes on a medium heat.When the mix begins to bubble, add the cooked kidney beans/rajma along with the water that was used for cooking it.
Stir well.Add Chipotle chilli along with Adobo sauce, crushed cumin and salt.
If using red chilli flakes instead, add it now.Mix it all up well and cook to make a thick sauce.
This may take 5-7 minutes.
Turn off the heat and keep it aside.For the sautéed peppers/vegetables, place a pan on heat, add some oil to it and allow it to get warm.Once done add all the chopped peppers (or any other vegetables that you may like) along with the garlic.Sprinkle salt and sauté for 1-2 minutes.
Then, add chilli flakes and oregano, toss together and turn off the heat.
Keep aside till ready to use.For the roasted corn salsa, char the corn on the stove top or in a preheated oven.
Take the kernels off the cob and put it in a bowl.Add in the rest of the ingredients and mix thoroughly.
Keep aside until later use.For the guacamole, prepare the Avocado guacamole but remember that guacamole needs to be eaten fresh, so this is one component that has to be made last, or just before assembling and serving the burrito bowl.To assemble the burrito bowl, if you are preparing one big bowl for your guests, use a fairly deep 8-9” flat bottom bowl or serving dish.A burrito bowl is essentially layered, so begin with the coriander-lime rice.
Spread it generously at the base of the bowl.Over it, spoon the spicy beans and spread it around the rice.Next, layer the sauteed peppers over the beans.On top of that goes a layer of guacamole.Spread some corn salsa over it, and top it with the lettuce (if using), cheese and black olives and serve.If you are making individual burrito bowls for a smaller crowd, follow the same sequence of layers, but use smaller sized ramekins for serving.To make a Burrito Bar, simply place all the prepared components on convenient location.
Give your guests individual bowls and allow them to choose their favorite toppings to assemble the bowls of their choice.To serve it as a warm winter casserole, once assembled, bake the bowl in a preheated oven at 180 degrees Celsius for 15 minutes and serve hot with baked Tortilla chips.Serve the Mexican Vegetarian Burrito Bowl for a wholesome dinner followed by a dessert of Apple Enchiladas.
",https://www.archanaskitchen.com/mexican-vegetarian-burrito-bowl-recipe,"tomato,yellow bell pepper (capsicum),lettuce leaves,coriander (dhania) leaves,virgin olive oil,black peppercorns,cloves garlic,chipotle chillies peppers (or flat red chilli flakes),onion,cumin seeds (jeera),red bell pepper (capsicum) (or other vegetables that can be stir ),rajma (large kidney beans) but not,dried oregano,sunflower oil,salt,coriander (dhania),cheddar cheese mexican cheese,del monte corn kernels fire,black olives,guacamole recipes,lemon,red chilli flakes,rice fluffy,green bell pepper (capsicum)",https://www.archanaskitchen.com/images/archanaskitchen/1-Author/Madhuli_Ajay/Vegetarian_Burrito_Bowls_Recipe_Archanas_Kitchen_-1.jpg,24
Dahi Bhindi Recipe - Okra in Yogurt Curry with Caramelized Onions,"1 cup Curd (Dahi / Yogurt),1/2 teaspoon Turmeric powder (Haldi),Sunflower Oil - for cooking,1 teaspoon Garam masala powder,Salt - to taste,1 tablespoon Caramelized onions,1 inch Ginger - grated,1 teaspoon Cumin seeds (Jeera),1 Onion - finely chopped,200 grams Bhindi (Lady Finger/Okra) - cut into 1 inch pieces,Coriander (Dhania) Leaves - a small bunch finely chopped,2 tablespoons Gram flour (besan),2 Dry Red Chillies,2 tablespoons Ghee,1/2 teaspoon Red Chilli powder",60,North Indian Recipes,"To begin making the Dahi Bhindi Recipe, we will first roast the Bhindi .Heat 2 tablespoons of oil in a Wok or a Kadai; add the chopped onions and the bhindi (okra).
Sprinkle some salt and sauté the bhindi and the onions on low heat.
Keep the pan covered for the few minutes so the bhindi gets cooked.When covered the bhindi releases moisture, but this moisture helps it to cook and soften as well.Once you notice that it has released a little moisture and the bhindi is slightly softened, open the pan and stir fry the bhindi until it is well roasted.
Make sure you roast it on medium heat.
Roast the Bhindi until you notice it has begun to shrink and has browned.
It should not become sticky, slimy and gooey.
If it has turned this way, add a little more oil and sprinkle some gram flour/besan and stir it gently.
This will absorb the sliminess.The bhindi is a tricky vegetable to cook, so it takes some practice to not making it gooey.Once the bhindi is cooked and well roasted, keep it aside till we prepare the yogurt gravy.To make the Yogurt Curry, add the yogurt into a saucepan; add the gram flour, grated ginger, garam masala powder,  turmeric powder and chili powder.
Whisk until smooth.
Add in 1/4 cup of water and whisk again until well combined.Place the saucepan on a medium heat and allow the yogurt mixture to come to a brisk boil.
Allow it to boil for a couple of minutes and then turn the heat to low.
Simmer the mixture until the yogurt becomes thick and creamy.
Once thick and creamy, add in the roasted bhindi and stir.
Simmer for a few more minutes.
Check the salt and spice levels and adjust to suit your taste.Turn off the heat and transfer the Dahi Bhindi a serving bowl.
The final step is to make the seasoning.
Heat a tablespoon of ghee in a Tadka Pan.
Add the cumin seeds, dry red chilies and roast them until lightly browned.Pour this seasoning and the caramelized onions into the Dahi Bhindi.
Stir to mix gently and finally stir in the chopped coriander leaves.Serve the Dahi Bhindi along with Phulka Recipe  or Steamed Rice and  Green Moong Sprout Salad for a simple weeknight dinner or even a weekend lunch.",https://www.archanaskitchen.com/dahi-bhindi-recipe-okra-in-yogurt-curry-with-caramelized-onions,"salt,coriander (dhania),ginger,ghee,red chilli powder,gram flour (besan),curd,dry red chillies,onion,cumin seeds (jeera),bhindi (lady fingerokra),turmeric powder,garam masala powder,sunflower oil",https://www.archanaskitchen.com/images/archanaskitchen/Indian_Vegetables_Gravy/Dahi_Bhindi_Sabzi_Okra_Yogurt_Curry_Recipe-2.jpg,14
Palak Paneer Bhurji Recipe - Palak Paneer Bhurji Recipe," oil - as per use, 2 cloves garlic - finely chopped, 2 tsp mango powder, 1 onion - finely chopped, 50 grams spinach - finely chopped, 2 green chillies - finely chopped, 2 tsp red chilli powder, 1/2 small Teaspoon cumin, 1 tbsp butter, salt - as per taste,200 grams cheese - pinch, 2 tsp garam masala powder, 1 tomato - finely chopped",45,North Indian Recipes,"To make the Palak Paneer Bhurji recipe, firstly make paneer.
You can also buy cheese from outside.
Steal the cheese and keep it aside.
Now heat oil in a pan.
Add cumin seeds and let it crackle.
After the cumin seeds crackle, add ginger, garlic, green chillies, onions and cook them till the onions turn light brown.
Now add tomatoes and cook till they become soft.
Add the spinach and cook until the spinach is cooked.
Now add red chili powder, garam masala powder, mango powder, paneer and mix well.
Add the butter and cook for 3 to 4 minutes.
After cooking, turn off the gas and serve hot.
Serve the spinach paneer bhurji with dal makhni, boondi raita and phulka for dinner.",https://www.archanaskitchen.com/palak-paneer-bhurji-recipe-spiced-cottage-cheese-scramble-with-spinach-recipe-in-hindi,"cheese,tomato,salt,cumin,spinach,red chilli powder,cloves garlic,onion,oil,mango powder,green chillies,butter,garam masala powder",https://www.archanaskitchen.com/images/archanaskitchen/0-Archanas-Kitchen-Recipes/2016/oct-6/Palak_Paneer_Bhurji_Recipe_Spice_Cottage_Cheese_Scramble_Serve_with_Toasted_Pav-2.jpg,13
Badam Halwa Recipe," 1 almond - silver coating (for garnish), 1/2 cup ghee, 2 saffron, 1 tablespoon wheat flour,1 cup almonds, 3/4 cup milk, 3/4 cup sugar",35,Awadhi,"To make almond pudding, first soak almonds in water for 6 to 8 hours.
Remove the skin from it after 8 hours.
Pour the almonds in the mixer grinder and make their course mixer.
Keep it aside.
Now add milk, water, sugar and saffron in a saucepan.
Cook until the sugar dissolves well.
Now heat ghee in a pan.
Add the almond mixture and roast it for 6 to 8 minutes.
Cook until the almond color changes.
After changing the color of the badam, slowly add milk to it.
Stir until the milk dissolves.
After cooking, turn off the gas and garnish with almonds.
Serve almond halwa sweet after dinner.",https://www.archanaskitchen.com/badam-halwa-recipe-in-hindi,"saffron,wheat flour,almonds,ghee,milk,sugar,almond silver",https://www.archanaskitchen.com/images/archanaskitchen/0-Archanas-Kitchen-Recipes/2016/1-Archana/Badam_Halwa_recipe-2.jpg,7
