TranslatedRecipeName,TranslatedIngredients,TotalTimeInMins,Cuisine,TranslatedInstructions,URL,Cleaned-Ingredients,image-url,Ingredient-count
Hyderabad Soy Biryani Recipe With Vegetables & Palak,"2 cups Basmati rice - soaked for 30 minutes,1/4 Mace (Javitri),Ghee - as needed,5 Badam (Almond),2 teaspoon Garam masala powder,1/4 cup Cauliflower (gobi) - chopped,1 teaspoon Red Chilli powder,3 Potatoes (Aloo) - cubed,1/4 cup Soy Chunks (Nuggets) - soaked in hot water for 15 minutes,1/4 cup Green beans (French Beans) - chopped,1 Cloves (Laung),3 Green Chillies,Salt - to taste,1/4 cup Green Bell Pepper (Capsicum) - chopped,1/4 teaspoon Cumin seeds (Jeera),1/2 cup Milk,1/2 cup Coriander (Dhania) Leaves,3 Cardamom (Elaichi) Pods/Seeds,4 Onions - chopped,1/2 teaspoon Ajwain (Carom seeds),1/4 cup Green peas (Matar),1/2 cup Mint Leaves (Pudina),1/4 cup Mint Leaves (Pudina) - roughly torn,2 inch Cinnamon Stick (Dalchini),2 Tomatoes - chopped,1 Black cardamom (Badi Elaichi),3 Cloves (Laung),1/2 teaspoon Turmeric powder (Haldi),1/4 cup Coriander (Dhania) Leaves - chopped,2 cups Onions - sliced,1 inch Cinnamon Stick (Dalchini),1 Cardamom (Elaichi) Pods/Seeds,8 cups Water,1-1/2 cups Spinach Leaves (Palak) - or 1 bunch,7 Saffron strands,2 tablespoons Ginger Garlic Paste,Sunflower Oil - to cook,1-1/2 teaspoon Coriander Powder (Dhania),1 Bay leaf (tej patta),1/4 cup Carrots (Gajjar) - chopped",90,Hyderabadi,"To begin making Hyderabad Soy Biryani Recipe With Vegetables & Palak, wash rice well and soak for half an hour.In a handi, boil water, almost  triple the quantity of rice or more, with salt and the whole spices mentioned above.
When the water comes to a boil, add the soaked rice and cook till almost done.
When almost a bite remains in the grains, drain the rice in a sieve.
Keep aside.
Warm a bowl of milk in a saucepan, and soak the saffron in it and keep aside till required.
In the meantime, heat a kadai with a bit of oil and on high heat, caramelise the onions with sprinkling some salt on it and sauteing them.
Keep aside.Now in the same kadai, with a bit of oil heated, add the potatoes and cook till they are shallow fried and crisp-cooked, season with salt and keep aside till required for layering.In another vessel, bring enough water to boil to cook the remaining vegetables except the capsicum.
Add the cauliflower first to the boiling water.
After about 6 minutes or when the cauliflower is softened half-way through, add the rest of the vegetables.
When almost done, drain from the clear stock and keep aside.
Reserve and use this water for making soups if you wish.
Take off soy chunks off the hot water, wash thoroughly and squeeze tightly to discard any extra water.
For the biryani, in another vessel heat oil and add to it all the whole spices mentioned and saute till aromatic.
Now add the remaining half of the chopped onions and saute on high flame.
Add a bit of salt to it.
Add the chopped capsicum too.
When onions turn translucent, add ginger garlic paste and saute well for a minute till the raw smell vanishes.
Now add turmeric and the chopped tomatoes.
Mix well and cover and cook for a while.
Add all the other dry spice powders and mix well.Meanwhile in a mixer grinder, puree the palak with other mentioned ingredients for palak puree.
Add the palak puree and mix well.
Keep stirring on high flame for a while.
Now add the beaten curds to the gravy and stir continuously on high flame.
Add the soya chunks and mix well.
Cover and cook.
After a few minutes, add the boiled and drained vegetables, and adjust salt to taste.
Mix well.
 Adjust seasoning or masalas now.
Add most of the fried onions reserving little for layering and garnishing.
When all the water has evaporated and the gravy has thickened, switch of heat.
Keep a thick griddle to heat on the stove top.
Place a handi on the griddle, just to ensure the even heat distribution such that the bottom of the biryani doesn't get burnt.
Now in the handi, start layering the biryani.
Start with spreading half the gravy at the bottom.
Cover with some cooked rice.
Spread some ghee, fried onions, potato cubes, coriander leaves and mint leaves over it.
Repeat layering so that you finish with caramelised onions on top most layer..
Make four vertical holes in the biryani with the handle of a spoon and pour saffron milk into it.
Cover the vessel with aluminium foil and shut the lid tightly over it.
Keep vessel on medium heat for dum.
Keep on high heat for first 3 minutes and then on a low heat for about 6-7 minutes.
Keep covered for few more minutes.
Open the lid and mix a bit or serve in layers.
Serve Hyderabad Soy Biryani Recipe With Vegetables & Palak along with Burani Raita Recipe (Garlic Based Yogurt), Pickled Onions Recipe, and Saunf Aloo & Dal Kebab Recipe (Potato & Lentil Kebabs).",https://www.archanaskitchen.com/hyderabad-soy-biryani-recipe-with-vegetables-palak,"tomato,basmati rice,coriander (dhania) leaves,ajwain (carom seeds),carrot,onion,cumin seeds (jeera),soy (nuggets),turmeric powder,green chillies,sunflower oil,salt,black cardamom (badi elaichi),spinach leaves (palak) bunch,cardamom (elaichi) podsseeds,mace (javitri),mint leaves (pudina),garam masala powder,green beans (french beans),cauliflower (gobi),red chilli powder,water,bay leaf (tej patta),ghee,milk,saffron strands,green peas (matar),ginger garlic paste,cinnamon stick (dalchini),badam (almond),green bell pepper (capsicum),coriander powder,potato (aloo),cloves (laung)",https://www.archanaskitchen.com/images/archanaskitchen/1-Author/panditp253-gmail.com/VEG_HYDERABADI_PAALAK_BIRYANI__recipe_edited.jpg,34
North Indian Feni Recipe - Sevaiyan Kheer,"2 tablespoons Raisins,100 grams Pheni - or one roll,1/4 cup Sugar,300 ml Milk,2 tablespoons Almond Meal (Badam Powder),1 tablespoon Ghee,2 tablespoons Cashew nuts",25,North Indian Recipes,"To begin making the North Indian Pheni Recipe, we will first get all the ingredients ready and keep them by the side.
In a heavy bottom pan, bring the milk to a brisk boil.
Lower the heat and simmer for 5 to 10 minutes till it thickens a little.
Once the milk has thickened a little, add the sugar and almond powder and simmer for another couple of minutes.The almond powder will help thicken the milk.
Add the pheni at this stage and mix well and turn off the heat.
Allow the milk and pheni mixture to rest in the pan for about 10 minutes.
This will help soften the pheni in the warm milk.Transfer the Pheni to a serving bowl.
In a small pan, heat the ghee on medium to low heat and roast cashew and raisins until golden brown and crisp.
Turn off the heat and pour it over the Pheni (Kheer).Serve North Indian Pheni as a dessert after your delicious festive meal of Jodhpuri Aloo, Ajwain Puri, Satvik Carrot Sprout Salad and Mirchi Ka Chunda.",https://www.archanaskitchen.com/north-indian-pheni-recipe-a-thin-silky-seviyan-kheer,"cashew nuts,pheni roll,ghee,milk,raisins,sugar,almond meal (badam powder)",https://www.archanaskitchen.com/images/archanaskitchen/1-Author/Monika_Manchanda/North_Indian_Pheni_Recipe_A_Thin_silky_Sewiyan_Kheer-1.jpg,7
South Indian Papad Curry Recipe - Appalam Vathal Kuzhambu (Recipe)," 1 teaspoon horse-powder, 3 teaspoons sesame oil, tamarind - as big as lemon, 1 teaspoon mustard, 1 tablespoon sambar powder, 1 pinch Asafoetida, 1/2 teaspoon gram lentils, 1 curry leaves, salt - as per taste, 1/4 teaspoon turmeric powder,4 papad - urad dal, 1 dry red chili",25,Tamil Nadu,"To make South Indian Papad Curry, dip tamarind in 2 cups of hot water and keep aside.
Heat 2 teaspoons of sesame oil in a pan on medium heat, and add mustard seeds and gram and wait for it to crackle.
Now add asafoetida, red chili and curry leaves and let it cook for 30-40 seconds.
Add chopped papads and fry them in oil.
Now add tamarind water, turmeric, horse and salt and cook until the tamarind is raw.
Finally add a teaspoon of oil and let it come to a boil, then turn off the gas.
South Indian Papad Curry is now ready, serve it with rice and chow chow kootu at dinner.",https://www.archanaskitchen.com/appalam-vathal-kuzhambu-recipe-in-hindi,"turmeric powder,salt,horsepowder,gram lentils,asafoetida,papad urad dal,mustard,dry red chilli,curry leaves,sesame oil,sambar powder,tamarind lemon",https://www.archanaskitchen.com/images/archanaskitchen/1-Author/nithya.anantham/Appalam_Vathal_Kuzhambu_Recipe_Spicy_and_Tangy_Papad_Curry.jpg,12
Moong Dal Khichdi Recipe For Babies And Toddlers Over 10 Months,"1/4 cup Rice,1 Carrot (Gajjar) - finely chopped,3 Green beans (French Beans) - finely chopped,1/4 teaspoon Cumin seeds (Jeera),1 teaspoon Ghee,Salt - a pinch,1/4 cup Yellow Moong Dal (Split),1/4 teaspoon Asafoetida (hing)",30,Indian,"To begin making the Moong Dal Khichdi For Babies And Toddlers, add yellow moong dal and rice along with 1 cup water in a pressure cooker.Pressure cook the dal and rice for 3 whistles, reduce the flame to low and leave it for 2 minutes.
After 2 minutes, turn off the flame and let the pressure release naturally.
Meanwhile, in another pressure cooker, add the chopped carrots, beans, add 2 tablespoons water and pressure cook for 2 whistles.
Turn off the heat and run the pressure cooker under cold water to release the pressure.
This will ensure that the vegetables are cooked without losing its colour and nutrition.
Next, place a kadai on low heat and add ghee.
Once the ghee melts, add jeera and allow it to crackle.
Once the jeera has crackled, add asafoetida and mix well into the ghee.
Add cooked carrots, beans, cooked dal and rice khichdi along with a pinch of salt.Stir to combine the Moong Dal Khichdi For Babies And Toddlers until it becomes almost smooth.
Turn off heat.
Moong Dal Khichdi for your baby is ready.
Serve this Moong Dal Khichdi to your babies/toddlers who are over 10 months for a wholesome lunch meal.
 ",https://www.archanaskitchen.com/moong-dal-khichdi-recipe-for-babies-and-toddlers-over-10-months,"salt,green beans (french beans),yellow moong dal (split),rice,ghee,asafoetida (hing),carrot,cumin seeds (jeera)",https://www.archanaskitchen.com/images/archanaskitchen/1-Author/sandhya-archanaskitchen.com/Moong_Dal_Khichdi_For_Babies_And_Toddlers_Over_9_months_1600.jpg,8
Dahi Wale Aloo Recipe (Indian Yogurt-based Potato Curry),"1-1/2 cups Curd (Dahi / Yogurt),1/2 Turmeric powder (Haldi),1/2 teaspoon Garlic - finely chopped,Salt - to taste,1 teaspoon Cumin seeds (Jeera),1/3 teaspoon Asafoetida (hing),1 teaspoon Red Chilli powder,4 tablespoons Sunflower Oil,1/2 teaspoon Ginger - finely chopped,1 Onion - finely chopped,2 tablespoons Gram flour (besan),1-1/2 teaspoon Coriander Powder (Dhania),2 Green Chillies - chopped,Coriander (Dhania) Leaves - chopped or garnish,1 sprig Curry leaves,4 Potatoes (Aloo) - chopped",55,North Indian Recipes,"To begin making Dahi Wale Aloo Recipe, first wash the potatoes thoroughly.
Then pressure cook them till they are cooked soft, but not completely mushy.
You can follow this method to learn how to pressure cook them.Once the pressure has released from the cooker, open the line, drain the water and allow the potatoes to cool.
Then, peel them and roughly break into chunks.In a large bowl, add curd and besan with a little water and whisk them together to make a smooth batter.
There should not be any lumps in the curds.
Whisk till it is smooth and then set aside.In a wok or kadhai, warm some oil.
Add cumin seeds and hing.
As soon as cumin begins to crackle, add finely chopped onion and saute till the onions soften.Next add the finely chopped ginger, garlic and green chilies along with the curry leaves and toss them all together for a couple of minutes.Add the red chilli powder, coriander powder and turmeric and saute the masala well until it is cooked through and begins to release oil from the sides.
If you find the masala sticking at this stage, add a little water (2 tablespoons) in it and toss well.Add the potatoes to the masala and mix again till the potatoes are well-coated.Turn the heat to low and start pouring the beaten curd over the potatoes.
Mix well.
Adjust salt as per your taste and close the lid to allow the curry to simmer for 5 minutes.Once done, turn the heat off, garnish with coriander leaves and serve with Steamed Rice or Phulkas.",https://www.archanaskitchen.com/dahi-wale-aloo-recipe-indian-yogurt-based-potato-curry,"salt,ginger,asafoetida (hing),coriander (dhania) leaves,red chilli powder,gram flour (besan),curd,curry leaves,onion,cumin seeds (jeera),garlic,coriander powder,potato (aloo),turmeric powder,green chillies,sunflower oil",https://www.archanaskitchen.com/images/archanaskitchen/1-Author/Shaheen_Ali/Dahi_Wale_Aloo_Recipe_2.jpg,16
Vegetable Fried Brown Rice Recipe,"Salt - as required,1/2 cup Green Bell Pepper (Capsicum) - chopped,2 tablespoons Garlic - chopped,Extra Virgin Olive Oil - as required,1 Onion - chopped,1 teaspoon Soy sauce,2 tablespoons Spring Onion Greens - chopped,1 teaspoon Vinegar,1 Green Chilli - chopped,1/2 cup Cabbage (Patta Gobi/ Muttaikose) - chopped,1/2 cup Carrots (Gajjar) - chopped,1/2 teaspoon Ginger - freshly grated,1/2 cup Green beans (French Beans) - chopped,1 tablespoon Red Chilli sauce,2 cups Brown Rice - cooked,1 tablespoon Roasted tomato pasta sauce - or store bought",40,Chinese,"To begin making the Vegetable Fried Brown Rice recipe, collect all the ingredients on the kitchen platform before you start cooking.You can use fresh cooked brown rice or even the left over brown rice.Heat oil in heavy bottomed pan and add garlic and saute till golden in colour.Now add onion and green chilies and again saute for 2 to 3 minutes till the raw smell goes off.Add in the rest of the chopped vegetables and fry them all.Season with salt and black pepper and then add vinegar and the three sauces together.Cook for 2 to 3 minutes on low flame and then add the pre cooked brown rice and mix well such that the flavours incorporate well.Turn off the gas stove and garnish the brown fried rice with some fresh spring onion greens and coriander.Brown rice when teamed up with plenty of fine vegetables and tossed in olive oil and sauces to give a Chinese flavour.
Vegetable Fried Brown Rice dish makes an amazing rice meal that can be anytime enjoyed with any Chinese curry like Indo-Chinese Paneer Manchurian.",https://www.archanaskitchen.com/vegetable-fried-brown-rice-recipe,"salt,green beans (french beans),brown rice,ginger,green chilli,spring onion greens,soy sauce,carrot,virgin olive oil,tomato pasta sauce store bought,garlic,onion,vinegar,green bell pepper (capsicum),red chilli sauce,cabbage (patta gobi muttaikose)",https://www.archanaskitchen.com/images/archanaskitchen/1-Author/Shaheen_Ali/VEGETABLE_FRIED_BROWN_RICE.jpg,16
Eggless Devil's Food Cake Recipe,"2 cups All Purpose Flour (Maida),Chocolate ganache - as needed,2/3 cup Cocoa Powder,1-1/2 teaspoons Baking powder,3 Whole Eggs - or Flaxmeal Egg Replacer,3 tablespoons Flax seed powder (flax meal),1/4 teaspoon Salt,1/2 teaspoon Red Food Color - (only optional),3/4 cup Curd (Dahi / Yogurt),9 tablespoons Chilled water,1-1/2 teaspoon Vanilla Extract,3/4 cup Butter - softened,1-1/2 cups Caster Sugar",110,Continental,"To begin making the Rich Dark Devil's Food Cake Recipe, we will first preheat the oven to 180 C.
Grease and flour 2 - 8 inch cake round cake pans.
Keep aside.To make the Flax Meal Egg Replacer If your recipe asks for 3 eggs, measure 3 tablespoons of flax meal along with 9 tablespoons of water.
Stir well and let the mixture rest for about 15 minutes.
This process of resting helps the flax meal mixture develop a gelatinous consistency similar to eggs.To make the Batter Sift the flour, baking powder, salt and cocoa powder and keep aside.In a large bowl or the bowl of the stand mixer, beat in the softened butter, vanilla and sugar until light and fluffy.
Add an egg at a time, whisking it into the butter mixture until light and fluffy(if making eggless, add the flaxmeal egg replacer)Gradually add in the butter milk and food coloring.
And finally, gradually fold in the flour mixture and continue to fold until the mixture is well blended and smooth.Divide the chocolate cake batter into 2 greased baking pans and place in the preheated oven to bake for about 35 to 45 minutes, until a tester when inserted in the center comes out clean.Once the cakes are baked, remove them from the oven and cool them completely.
While the cake is cooling, prepare the Chocolate Ganache recipe.
Place one cake on the serving tray in which you plan to set the cake.
Spread a generous portion of the chocolate ganache on the top of the cake.
Place the other cake over the bottom one and lightly press down.
Finally cover the whole cake with the Chocolate Ganache including the sides and the top.
Refrigerate the cake for at least 4 to 5 hours.Serve the Rich Dark Chocolate Devils Food Cake along with a cup of coffee or as a dessert for parties.",https://www.archanaskitchen.com/devils-food-cake-recipe-with-eggless-egg-free-option,"baking powder,salt,chocolate ganache,flax seed powder (flax meal),water,curd,vanilla,eggs flaxmeal eggs replacer,caster sugar,cocoa powder,red food color (only ),flour (maida),butter",https://www.archanaskitchen.com/images/archanaskitchen/Dessert_Cakes/devils_food_cake_Recipe_dark_chocolate_layered_cake_shutterstock_140804998_1600.jpg,13
Bengali Langcha Recipe With Mawa,"1 cup Milk Powder,1 tablespoon Sooji (Semolina/ Rava),1/2 cup Milk,1/8 teaspoon Baking soda,1 tablespoon Caster Sugar,1/2 cup All Purpose Flour (Maida),1 teaspoon Cardamom Powder (Elaichi),Ghee - or Vegetable oil,1 teaspoon Pistachios - chopped,2-1/2 cups Water,2 cups Sugar",50,Bengali Recipes,"Making dough for langcha:To begin making Bengali Langcha Recipe With Mawa, first start by making dough for langcha.
Take a bowl add milk powder, all purpose flour, semolina, baking powder, whole milk( pouring small milk at a time) and make a soft dough.Cover it with damp cloth and keep aside for 10 minutes.
After 10 minutes add 1 pinch of food color(optional)and powder sugar mix it well.
Rest it for another 5 to 10 minutes.Wet your hands.
Take small amount of dough and pressing by hands give it a  oblong shape like langcha.Keep the size of sweets small from your desire size, it will puff up after frying.Making sugar syrup:When the dough is resting let's make the sugar syrup .
In a big pan add sugar and water (1:1.25 ratio), boil until sugar dissolves completely.
Add a pinch of cardamom powder and mix well.
Keep aside.Frying Langcha:In a deep frying pan, heat vegetable oil or ghee.
Then slowly add lanchas not crowded much and fry it until brown in low flame.
If flame is high then langcha will take color easily but not cook from inside.Take out fried langcha and place it on a paper towel.Warm up the sugar syrup.
Add fried langcha slowly in hot sugar syrup.
Let them soak for 3-4 hours, then serve.
Serve it hot or refrigerate for 1 hour then serve, as per your wish.Serve Bengali Langcha Recipe With Mawa as a dessert along with a meal of Steamed rice, Kanchakalar Khosha Bata, Bengali Posto Porota Recipe (Spiced Poppy Seed Parathas), Bengali Style Cholar Dal Recipe and Posto Pabda (Bengali Fish Curry In Poppy Seeds Paste)",https://www.archanaskitchen.com/bengali-langcha-recipe-with-mawa,"pistachios,milk,ghee vegetable oil,water,baking soda,sugar,caster sugar,cardamom powder (elaichi),sooji (semolina rava),flour (maida),milk powder",https://www.archanaskitchen.com/images/archanaskitchen/1-Author/usashis-gmail.com/Langcha_A_sweet_from_West_Bengal.jpg,11
Kovakkai Podi Curry Recipe - Tamil Nadu Style Ivy Gourd Stir Fry,"1 Dry Red Chilli,4 Dry Red Chillies,2 tablespoons Coriander (Dhania) Seeds,Salt - to taste,400 grams Tindora (Dondakaya/ Kovakkai) - thinly sliced vertically,1/2 teaspoon White Urad Dal (Split),1 teaspoon Mustard seeds,pinch Asafoetida (hing),1 tablespoon Sunflower Oil,1 tablespoon Chana dal (Bengal Gram Dal),1/4 teaspoon Asafoetida (hing),1 sprig Curry leaves,1 tablespoon White Urad Dal (Split)",35,Tamil Nadu,"To begin making Kovakkai Podi Curry Recipe, dry roast the ingredients mentioned in the spicy lentil mix table and grind it to a coarse mix using a hand blender or Mixer and keep aside.Heat oil in a Kadai on medium flame, add the mustard seeds, urad dal and let it splutter.Add the asafoetida, dry red chilli and curry leaves and let it splutter.Now add the sliced ivy gourds and give it a good stir.Sprinkle with a little water, mix and let it cook with the lid closed.
This will take around 10 minutes.Once the ivy gourds are cooked yet firm, add the lentil spice mix and stir well.Let the ivy gourds roast on low flame for another 10 minutes, and occasionally keep stirring the mix in between.Switch off the flame once it is done.Serve the spicy Kovakkai Podi Curry Recipe along with Steamed Rice, Tomato Onion sambar, Pepper Rasam and Curd for a full course Tamil Nadu Style lunch.",https://www.archanaskitchen.com/kovakkai-podi-curry-recipe-tamil-nadu-style-ivy-gourd-stir-fry,"salt,asafoetida (hing),mustard seeds,tindora (dondakaya kovakkai)verticy,dry red chilli,curry leaves,white urad dal (split),coriander (dhania) seeds,dry red chillies,chana dal (bengal gram dal),sunflower oil",https://www.archanaskitchen.com/images/archanaskitchen/1-Author/Nithya_Anantham/Kovakkai_Podi_Curry_Recipe_Ivy_Gourd_Stir_Fried_In_Spicy_Lentil_Mix_recipe.jpg,11
Biryani Masala Powder Recipe - Biryani Masala Powder Recipe," 5 tablespoons coriander seeds, 6 cardamom, 5 Long, 2 tablespoons cumin seeds, 2 tablespoons whole pepper,2 bay leaves, 1/4 small Spoon Nutmeg Powder, 2 tablespoons celery, 3 stone flowers, 1 large cardamom, 3 mace, 2 inch Cinnamon, 3 star anis",10,Hyderabadi,"To make Biryani Masala Powder recipe, firstly put coriander seeds, whole black pepper in a pan and roast it well for 10 to 15 seconds.
Now add cumin, long, cinnamon and roast it for 10 seconds.
After 10 seconds, add bay leaves, celery, cardamom, big cardamom, mace, stone flower, star anise, nutmeg powder and bake it for 1 minute.
Turn off the gas and allow this mixture to cool.
After it cools down, put it in a mixer grinder and grind it into a powder.
Use Biryani Masala Powder recipe to make Gobi Biryani or Chicken Biryani.
You can serve this biryani with raita of your choice.",https://www.archanaskitchen.com/biryani-masala-powder-recipe-in-hindi,"mace,star anis,cinnamon,st flowers,celery,large cardamom,cardamom,bay leaves,pepper,coriander seeds,cumin seeds,spoon nutmeg powder",https://www.archanaskitchen.com/images/archanaskitchen/1-Author/sibyl_sunitha/Biryani_Masala_Powder_Recipe.jpg,12
